{
  "skema": "1.0",
  "dibuat": "2026-10-25T23:16:22+00:00",
  "jumlah": 49,
  "kajian": [
    {
      "id": "604716369a4e",
      "judul": "Kajian Intensif Lanjutan",
      "tema": "Tafsir Surah Al-Ahzab S.d. Surah Fathir",
      "kitab": null,
      "ustadz": [
        "Ustadz Dzulqarnain M. Sunusi"
      ],
      "tanggal": "2026-10-26",
      "tanggal_perkiraan": false,
      "hari": "Ahad",
      "rutin": null,
      "waktu": {
        "mulai": "10:00",
        "selesai": null,
        "acuan_shalat": null,
        "relasi": null
      },
      "zona_waktu": "WITA",
      "mulai_iso": "2026-10-26T10:00:00+08:00",
      "tempat": {
        "nama": "Masjid As-Sunnah",
        "alamat": "Jl. Baji Rupa No. 8 Makassar",
        "peta": null
      },
      "wilayah": {
        "kode": "73.71",
        "kabkota": "Kota Makassar",
        "provinsi": "Sulawesi Selatan",
        "slug": "kota-makassar",
        "zona_waktu": "WITA"
      },
      "mode": "offline",
      "streaming": null,
      "peserta": "umum",
      "sumber": [
        {
          "id": "jadwalkajiansunnah",
          "nama": "Telegram @jadwalkajiansunnah",
          "url": "https://t.me/jadwalkajiansunnah/13058",
          "diteruskan_dari": "Dzulqarnain Muhammad Sunusi",
          "diposting": "2026-10-24T20:36:03+00:00"
        }
      ],
      "pertama_dilihat": "2026-10-24T23:13:34+00:00",
      "terakhir_dilihat": "2026-10-25T23:16:22+00:00"
    },
    {
      "id": "8c2486a07264",
      "judul": "Kajian Renungan Fajar",
      "tema": "Santri Harapan Bangsa",
      "kitab": null,
      "ustadz": [
        "Dr. KH. Masruhin Abd. Majid, MA."
      ],
      "tanggal": "2026-10-26",
      "tanggal_perkiraan": false,
      "hari": "Senin",
      "rutin": null,
      "waktu": {
        "mulai": null,
        "selesai": null,
        "acuan_shalat": "Subuh",
        "relasi": "setelah"
      },
      "zona_waktu": "WIB",
      "mulai_iso": null,
      "tempat": {
        "nama": "Masjid Istiqlal",
        "alamat": null,
        "peta": null
      },
      "wilayah": {
        "kode": "31.71",
        "kabkota": "Kota Administrasi Jakarta Pusat",
        "provinsi": "Daerah Khusus Ibukota Jakarta",
        "slug": "kota-administrasi-jakarta-pusat",
        "zona_waktu": "WIB"
      },
      "mode": "offline",
      "streaming": null,
      "peserta": null,
      "sumber": [
        {
          "id": "istiqlal-rutin",
          "nama": "Masjid Istiqlal - Jadwal Rutin Kajian Hari Ini",
          "url": "https://www.istiqlal.or.id/artikel/kategori/keislaman",
          "diteruskan_dari": null,
          "diposting": "2026-10-25T23:16:22.350521+00:00"
        }
      ],
      "pertama_dilihat": "2026-10-25T23:16:22+00:00",
      "terakhir_dilihat": "2026-10-25T23:16:22+00:00"
    },
    {
      "id": "b4023669ba6a",
      "judul": "Kajian Dialog Zuhur",
      "tema": "Mukasyafatul Qulub (TASAWUF)",
      "kitab": null,
      "ustadz": [
        "Dr. H. Mulawarman Hannase, Lc, M.Hum."
      ],
      "tanggal": "2026-10-26",
      "tanggal_perkiraan": false,
      "hari": "Senin",
      "rutin": null,
      "waktu": {
        "mulai": null,
        "selesai": null,
        "acuan_shalat": "Dzuhur",
        "relasi": "setelah"
      },
      "zona_waktu": "WIB",
      "mulai_iso": null,
      "tempat": {
        "nama": "Masjid Istiqlal",
        "alamat": null,
        "peta": null
      },
      "wilayah": {
        "kode": "31.71",
        "kabkota": "Kota Administrasi Jakarta Pusat",
        "provinsi": "Daerah Khusus Ibukota Jakarta",
        "slug": "kota-administrasi-jakarta-pusat",
        "zona_waktu": "WIB"
      },
      "mode": "offline",
      "streaming": null,
      "peserta": null,
      "sumber": [
        {
          "id": "istiqlal-rutin",
          "nama": "Masjid Istiqlal - Jadwal Rutin Kajian Hari Ini",
          "url": "https://www.istiqlal.or.id/artikel/kategori/keislaman",
          "diteruskan_dari": null,
          "diposting": "2026-10-25T23:16:22.350521+00:00"
        }
      ],
      "pertama_dilihat": "2026-10-25T23:16:22+00:00",
      "terakhir_dilihat": "2026-10-25T23:16:22+00:00"
    },
    {
      "id": "fe19379efeeb",
      "judul": "Kajian Khawamisy",
      "tema": "Tarikh Tasyri’ Al Islami (FIQH)",
      "kitab": null,
      "ustadz": [
        "Tarikh Tasyri’ Al Islami"
      ],
      "tanggal": "2026-10-26",
      "tanggal_perkiraan": false,
      "hari": "Senin",
      "rutin": null,
      "waktu": {
        "mulai": null,
        "selesai": null,
        "acuan_shalat": "Ashar",
        "relasi": "setelah"
      },
      "zona_waktu": "WIB",
      "mulai_iso": null,
      "tempat": {
        "nama": "Masjid Istiqlal",
        "alamat": null,
        "peta": null
      },
      "wilayah": {
        "kode": "31.71",
        "kabkota": "Kota Administrasi Jakarta Pusat",
        "provinsi": "Daerah Khusus Ibukota Jakarta",
        "slug": "kota-administrasi-jakarta-pusat",
        "zona_waktu": "WIB"
      },
      "mode": "offline",
      "streaming": null,
      "peserta": null,
      "sumber": [
        {
          "id": "istiqlal-rutin",
          "nama": "Masjid Istiqlal - Jadwal Rutin Kajian Hari Ini",
          "url": "https://www.istiqlal.or.id/artikel/kategori/keislaman",
          "diteruskan_dari": null,
          "diposting": "2026-10-25T23:16:22.350521+00:00"
        }
      ],
      "pertama_dilihat": "2026-10-25T23:16:22+00:00",
      "terakhir_dilihat": "2026-10-25T23:16:22+00:00"
    },
    {
      "id": "61be20b4f59d",
      "judul": "Kajian Qobla Jumat",
      "tema": null,
      "kitab": null,
      "ustadz": [],
      "tanggal": "2026-10-30",
      "tanggal_perkiraan": true,
      "hari": "Jumat",
      "rutin": null,
      "waktu": {
        "mulai": null,
        "selesai": null,
        "acuan_shalat": null,
        "relasi": null
      },
      "zona_waktu": "WIB",
      "mulai_iso": null,
      "tempat": {
        "nama": "Masjid Istiqlal",
        "alamat": null,
        "peta": null
      },
      "wilayah": {
        "kode": "31.71",
        "kabkota": "Kota Administrasi Jakarta Pusat",
        "provinsi": "Daerah Khusus Ibukota Jakarta",
        "slug": "kota-administrasi-jakarta-pusat",
        "zona_waktu": "WIB"
      },
      "mode": "offline",
      "streaming": null,
      "peserta": null,
      "sumber": [
        {
          "id": "istiqlal-rutin",
          "nama": "Masjid Istiqlal - Jadwal Rutin Kajian Hari Ini",
          "url": "https://www.istiqlal.or.id/artikel/kategori/keislaman",
          "diteruskan_dari": null,
          "diposting": "2026-10-23T23:51:41.866480+00:00"
        }
      ],
      "pertama_dilihat": "2026-10-23T23:51:41+00:00",
      "terakhir_dilihat": "2026-10-25T23:16:22+00:00"
    },
    {
      "id": "4b8b93127342",
      "judul": null,
      "tema": null,
      "kitab": null,
      "ustadz": [
        "Ustadz Muhammad Nuzul Dzikri"
      ],
      "tanggal": null,
      "tanggal_perkiraan": false,
      "hari": "Sabtu",
      "rutin": "setiap hari Sabtu, Pukul 07.00 WIB",
      "waktu": {
        "mulai": "07:00",
        "selesai": null,
        "acuan_shalat": null,
        "relasi": null
      },
      "zona_waktu": "WIB",
      "mulai_iso": null,
      "tempat": {
        "nama": "Masjid Nurul Iman",
        "alamat": "lt.7 Blok-M Square, Kebayoran Baru, Jakarta Selatan",
        "peta": "https://goo.gl/maps/p26d1YXFeeT2"
      },
      "wilayah": {
        "kode": "31.74",
        "kabkota": "Kota Administrasi Jakarta Selatan",
        "provinsi": "Daerah Khusus Ibukota Jakarta",
        "slug": "kota-administrasi-jakarta-selatan",
        "zona_waktu": "WIB"
      },
      "mode": "offline",
      "streaming": null,
      "peserta": null,
      "sumber": [
        {
          "id": "jadwalkajiansunnah",
          "nama": "Telegram @jadwalkajiansunnah",
          "url": "https://t.me/jadwalkajiansunnah/12915",
          "diteruskan_dari": "Muhammad Nuzul Dzikri",
          "diposting": "2026-10-23T23:09:17+00:00"
        }
      ],
      "pertama_dilihat": "2026-10-23T23:51:41+00:00",
      "terakhir_dilihat": "2026-10-25T23:16:22+00:00"
    },
    {
      "id": "eeceb54211c4",
      "judul": null,
      "tema": null,
      "kitab": null,
      "ustadz": [
        "Ustadzah Shinta",
        "Setiap hari Sabtu"
      ],
      "tanggal": null,
      "tanggal_perkiraan": false,
      "hari": "Sabtu",
      "rutin": "Setiap hari Sabtu",
      "waktu": {
        "mulai": "07:30",
        "selesai": null,
        "acuan_shalat": null,
        "relasi": null
      },
      "zona_waktu": "WIB",
      "mulai_iso": null,
      "tempat": {
        "nama": "Masjid Mutiara Sunnah",
        "alamat": "Perum. D'Ahsana Kedanyang",
        "peta": null
      },
      "wilayah": {
        "kode": "11.07",
        "kabkota": "Kabupaten Pidie",
        "provinsi": "Aceh",
        "slug": "kabupaten-pidie",
        "zona_waktu": "WIB"
      },
      "mode": "offline",
      "streaming": null,
      "peserta": "akhwat",
      "sumber": [
        {
          "id": "jadwalkajiansunnah",
          "nama": "Telegram @jadwalkajiansunnah",
          "url": "https://t.me/jadwalkajiansunnah/11441",
          "diteruskan_dari": "Gresik Mengaji",
          "diposting": "2026-10-10T00:34:53+00:00"
        },
        {
          "id": "jadwalkajiansunnah",
          "nama": "Telegram @jadwalkajiansunnah",
          "url": "https://t.me/jadwalkajiansunnah/12942",
          "diteruskan_dari": "Gresik Mengaji",
          "diposting": "2026-10-23T23:29:54+00:00"
        }
      ],
      "pertama_dilihat": "2026-10-11T13:05:01+00:00",
      "terakhir_dilihat": "2026-10-25T23:16:22+00:00"
    },
    {
      "id": "8a57b556d849",
      "judul": null,
      "tema": null,
      "kitab": null,
      "ustadz": [
        "Ummu Muhammad Ferial Said"
      ],
      "tanggal": null,
      "tanggal_perkiraan": false,
      "hari": "Jumat",
      "rutin": "Setiap Hari Jumat Pagi",